{
  "schema": "barista.bench.results/v1",
  "manifest_id": "P03-package-warm",
  "baseline_id": "barista",
  "resolved_command": "barista package -DskipTests",
  "run_id": "2026-05-18T13:38:21Z-7b1b33a1",
  "timestamp": "2026-05-18T13:38:21Z",
  "git_sha": "7b1b33a1e2f2a5c0a2c3b320479beb77580bd5da",
  "barista_version": "0.1.0-alpha.0",
  "hardware_tier": 2,
  "runner_id": "ajb-mbp.local",
  "hardware": {
    "id": "ajb-mbp.local",
    "cpu": "Apple M4 Max",
    "cores_physical": 16,
    "cores_logical": 16,
    "memory_gb": 128,
    "os": "macOS 26.2"
  },
  "iterations": [
    {
      "iteration": 0,
      "wall_ms": 984,
      "exit_code": 0
    },
    {
      "iteration": 1,
      "wall_ms": 1045,
      "exit_code": 0
    },
    {
      "iteration": 2,
      "wall_ms": 966,
      "exit_code": 0
    },
    {
      "iteration": 3,
      "wall_ms": 996,
      "exit_code": 0
    },
    {
      "iteration": 4,
      "wall_ms": 1077,
      "exit_code": 0
    },
    {
      "iteration": 5,
      "wall_ms": 938,
      "exit_code": 0
    },
    {
      "iteration": 6,
      "wall_ms": 963,
      "exit_code": 0
    },
    {
      "iteration": 7,
      "wall_ms": 968,
      "exit_code": 0
    },
    {
      "iteration": 8,
      "wall_ms": 1042,
      "exit_code": 0
    },
    {
      "iteration": 9,
      "wall_ms": 1032,
      "exit_code": 0
    }
  ],
  "summary": {
    "avg_wall_ms": 1001.1,
    "median_wall_ms": 990.0,
    "p95_wall_ms": 1077.0,
    "stddev_wall_ms": 45.209266503425795
  },
  "metadata": {
    "baseline_display_name": "barista package -DskipTests (warm daemon)",
    "corpus_id": "spring-boot-starter-web-app-3.3.5"
  }
}
